"component","seed","run_id","run_ts"
"Multiple imputation (mice)","20251206","20260421_092434","2026-04-21 09:24:34.367118"
"ABG propensity GBM (non-MI)","42","20260421_092434","2026-04-21 09:24:34.367118"
"VBG propensity GBM (non-MI)","42","20260421_092434","2026-04-21 09:24:34.367118"
"MI PS (glm RCS) seeds (ABG per imputation)","20251206 + imputation index","20260421_092434","2026-04-21 09:24:34.367118"
"MI PS (glm RCS) seeds (VBG per imputation)","30251206 + imputation index","20260421_092434","2026-04-21 09:24:34.367118"
