"component","seed","run_id","run_ts"
"Multiple imputation (mice)","20251206","20260421_073405","2026-04-21 07:34:05.211923"
"ABG propensity GBM (non-MI)","42","20260421_073405","2026-04-21 07:34:05.211923"
"VBG propensity GBM (non-MI)","42","20260421_073405","2026-04-21 07:34:05.211923"
"MI PS (glm RCS) seeds (ABG per imputation)","20251206 + imputation index","20260421_073405","2026-04-21 07:34:05.211923"
"MI PS (glm RCS) seeds (VBG per imputation)","30251206 + imputation index","20260421_073405","2026-04-21 07:34:05.211923"
