"component","seed","run_id","run_ts"
"Multiple imputation (mice)","20251206","20260423_111150","2026-04-23 11:11:50.486947"
"ABG propensity GBM (non-MI)","42","20260423_111150","2026-04-23 11:11:50.486947"
"VBG propensity GBM (non-MI)","42","20260423_111150","2026-04-23 11:11:50.486947"
"MI PS (glm RCS) seeds (ABG per imputation)","20251206 + imputation index","20260423_111150","2026-04-23 11:11:50.486947"
"MI PS (glm RCS) seeds (VBG per imputation)","30251206 + imputation index","20260423_111150","2026-04-23 11:11:50.486947"
