"component","seed","run_id","run_ts"
"Multiple imputation (mice)","20251206","20260418_181847","2026-04-18 18:18:47.686485"
"ABG propensity GBM (non-MI)","42","20260418_181847","2026-04-18 18:18:47.686485"
"VBG propensity GBM (non-MI)","42","20260418_181847","2026-04-18 18:18:47.686485"
"MI PS (glm RCS) seeds (ABG per imputation)","20251206 + imputation index","20260418_181847","2026-04-18 18:18:47.686485"
"MI PS (glm RCS) seeds (VBG per imputation)","30251206 + imputation index","20260418_181847","2026-04-18 18:18:47.686485"
